Header,Panjang_Basa,GC_Content_Persen,A,T,G,C
CP001509.3 Escherichia coli BL21(DE3), complete genome,4558953,50.83,1121882,1119636,1157627,1159808
U00096.3 Escherichia coli str. K-12 substr. MG1655, complete genome,4641652,50.79,1142742,1141382,1177437,1180091
NC_011750.1 Escherichia coli IAI39, complete sequence,5132068,50.63,1268010,1265665,1292707,1305686
AE014075.1 Escherichia coli CFT073, complete genome,5231428,50.47,1297551,1293044,1319228,1321325
AE005174.2 Escherichia coli O157:H7 str. EDL933 genome,5528445,50.38,1369964,1366445,1391726,1393669
